{
  "type": "LedgerRecorded",
  "schemaVersion": 1,
  "messageId": "100925016375300100",
  "commandId": "100925016375300098",
  "sagaId": "100925016375300097",
  "orderId": "100925016375300096",
  "buyerId": "21380884070404097",
  "requestFingerprint": "82b3421671a774507e4510d61f97e4ddad802b53332e367b66e5e2eb3814c45f",
  "occurredAt": "2026-10-06T12:00:01Z",
  "amount": "39.90",
  "currency": "EUR",
  "outcome": "RECORDED",
  "decidedAt": "2026-10-06T12:00:01Z"
}
